Tweet;klasifikasi
hi sis anton anything help xlhome fiber thanks adi;Netral
hi sis anyone asked xlhome fiber please dm adi;Netral
hi sis anyone asked xlhome products conveyed via dm dian;Netral
hi sis anything asked xlhome fiber service dian;Positif
hi sis anything asked xlhome fiber service fitri;Positif
hi sis anything asked xlhome fiber service please inform dm fitri;Positif
hi sis anything asked xlhome fiber service thanks ersa;Positif
hi sis anything help xlhome adi;Positif
hi sis anything help xlhome april;Positif
hi sis anything help xlhome fiber thanks adi;Negatif
hi sis anything help xlhome information details please dm adi;Positif
hi sis ardxaxo sorry inconvenience regarding xlhome fiber services conveyed via dm thanks dian;Netral
hi sis ari anything help xlhome fiber thanks adi;Negatif
hi sis arief anything asked xlhome fiber service thanks yuri;Positif
hi sis arsad anything help xlhome fiber thanks adi;Netral
hi sis aspartame apologize inconvenience regarding xlhome fiber services conveyed via dm thanks dian;Positif
hi sis assets anything help xlhome fiber thanks adi;Positif
hi sis ayuu anything help xlhome fiber thanks adi;Netral
hi sis azkapr wait network area update currently xlhome fiber expanding network area hopefully arrive address thanks adi;Netral
hi sis bandung area yet covered xlhome fiber network information whether area covered please check yes raffi;Netral
hi sis ben sorry inconvenience anything help xlhome fiber thanks adi;Netral
hi sis brianna related xlhome fiber service conveyed via dm yes thanks dian;Netral
hi sis budianto xlhome fiber already several cities sis details checked directly know thanks adi;Netral
hi sis cen related xlhome fiber services conveyed via dm thanks ersa;Netral
hi sis chaidir anything help xlhome fiber thanks adi;Netral
hi sis convey still follow sis present helped coordinate xlhome team please wait update adi;Netral
hi sis currently city brother covered xlhome fiber network information whether area covered please check adi;Positif
hi sis currently xlhome effort expand network ambon area update waiting let s submit network addition area website used next recommendation thanks adi;Positif
hi sis currently xlhome still expansion network area please wait update information whether area covered please check adi;Positif
hi sis dedi thank support anything help xlhome fiber thanks adi;Netral
hi sis dedy apologize inconvenience regarding xlhome fiber services conveyed via dm thanks dian;Positif
hi sis dhikaswandika related xlhome fiber service conveyed via dm yes thanks dian;Positif
hi sis dieselindra related xlhome fiber services conveyed via dm yes thanks dian;Positif
hi sis discouraged using handphonepun comfortable using xlhome fiber network thanks adi;Netral
hi sis dullah sorry inconvenience still things want ask xlhome fiber service contact us sis thanks adi;Positif
hi sis dwy anything help xlhome fiber thanks adi;Positif
hi sis eq responded dm please check regarding xlhome fiber services conveyed via dm thanks dian;Positif
hi sis er sorry inconvenience regarding xlhome fiber services conveyed via dm thanks dian;Positif
hi sis eric related xlhome fiber services conveyed via dm thanks dian;Positif
hi sis esha anything help xlhome fiber thanks adi;Positif
hi sis fair wait news expansion network area sis currently xlhome fiber network covered ciganjur area thanks adi;Positif
hi sis fakhrinaufalf related xlhome fiber service conveyed via dm yes thanks dian;Positif
hi sis fauzi waiting expansion network area sis currently xlhome fiber expanding network area hopefully soon arrive location brother let s submit network addition;Positif
hi sis fendri currently city garden cengkareng timu area still covered xlhome fiber information whether area covered please check wait update thanks adi;Positif
hi sis good morning anything help xlhome fiber thanks adi;Positif
hi sis good morning help xlhome adi;Positif
hi sis guwonrizki help xlhome fiber thanks adi;Netral
hi sis hairul anything help xlhome fiber thanks adi;Netral
hi sis help check address covered xlhome fiber network information whether area covered please check yes dian;Positif
hi sis help check address covered xlhome fiber network information whether area covered please check yes fitri;Netral
hi sis help xlhome adi;Positif
hi sis help xlhome fiber adi;Positif
hi sis hizam anything help xlhome fiber thanks adi;Netral
hi sis ida anything help xlhome fiber thanks adi;Netral
hi sis ilham related xlhome fiber service conveyed via dm thanks dian;Positif
hi sis imam apologize inconvenience regarding xlhome fiber services conveyed via dm thanks dian;Netral
hi sis imand thank information time watch let alone use xlhome fiber network thanks adi;Netral
hi sis imron anything help xlhome fiber thanks adi;Netral
hi sis inform area yet covered xlhome fiber network information whether area covered please check yes raffi;Positif
hi sis inform netflix access stb xlhome laptop cellphone cost subscribing netflix cost subcribe outside cost subscribing xl home yes sis vevi;Netral
hi sis inform several areas balikpapan covered xlhome network information whether area covered please check yes vevi;Netral
hi sis inform us netflix still unable used xlhome fiber device still process integration time present netflix access set top box cannot done yet;Netral
hi sis information xl home one faster handling maya suggests contact xlhome digital care via email xlhomecs co id fb xlhomeid twitter tel xl cont;Netral
hi sis informed advance full address based name housing complex roads blocks rt rw house numbers help check whether area covered xlhome network dian;Positif
hi sis intended modem xlhome fiber xlhome broadband ask xlhome broadband please contact twitter facebook myxlcare adi;Positif
hi sis iqbaal related xlhome fiber services conveyed via dm thanks dian;Positif
hi sis iqbal questions xlhome products services contact us via dm thanks ersa;Positif
hi sis iqbal xlhome one unlimited without fup yes sis please please inform full address via dm name road rt rw block houses lurah district city help check thanks ersa;Netral
hi sis issafiah anything help xlhome fiber thanks adi;Positif
hi sis javangkp sorry inconvenience regarding xlhome fiber services conveyed via dm thanks dian;Netral
hi sis jee anything help xlhome fiber thanks adi;Netral
hi sis joko sorry inconvenience regarding xlhome fiber services conveyed via dm thanks dian;Netral
hi sis joshua anything help xlhome fiber thanks adi;Negatif
hi sis kristin anything help xlhome fiber thanks adi;Positif
hi sis legoedwipamahardhika apologize inconvenience regarding xlhome fiber services conveyed via dm thanks dian;Netral
hi sis made related xlhome fiber services conveyed via dm thanks dian;Positif
hi sis mas anything help xlhome fiber thanks adi;Positif
hi sis maya recommends contact xlhome digital care via email xlhomecs co id fb xlhomeid twitter call xl non xl;Positif
hi sis michael apologize inconvenience regarding xlhome fiber services conveyed via dm thanks dian;Netral
hi sis michael currently xlhome fiber also provides internet packages let s turn dm details thanks adi;Netral
hi sis muhammad apologize inconvenience regarding xlhome fiber services conveyed via dm thanks dian;Netral
hi sis muhammad good afternoon help xlhome fiber thanks adi;Netral
hi sis muhammad related xlhome fiber services conveyed via dm thanks dian;Positif
hi sis mul related xlhome fiber service conveyed via dm yes thanks dian;Netral
hi sis nadi yes sis especially using xlhome fiber network thanks adi;Netral
hi sis namrifartupas related xlhome fiber service conveyed via dm yes thanks dian;Positif
hi sis netflix service unrivaled xlhome fiber service cost subscription outside xlhome monthly package adi;Positif
hi sis nio related xlhome fiber service conveyed via dm yes thanks dian;Netral
hi sis novi currently solo area still covered xlhome fiber information whether area covered please check wait update thanks adi;Positif
hi sis nurliah anything help xlhome fiber thanks adi;Positif
hi sis oki anything asked xlhome fiber service thanks yuri;Negatif
hi sis okina currently xlhome fiber expanding network area let s submit additional network brother s area website make recommendation;Positif
hi sis please dm questions xlhome adi;Positif
hi sis please wait news present xlhome fiber trying expand network area hopefully area sister immediately covered network thanks adi;Positif
hi sis puterad anything help xlhome fiber thanks adi;Positif
hi sis questions complaints related xlhome services delivered via message raffi;Netral
hi sis questions related xlhome fiber service conveyed via dm vevi;Negatif
hi sis questions related xlhome fiber services conveyed via dm first vevi;Positif
hi sis questions xlhome contact us xl free non-xl normal rates xlhomecs co idfb xl hometwitter ersa;Positif
hi sis questions xlhome contact us xl free non-xl normalmail rate xlhomecs co idfb xl hometwitter vevi;Positif
hi sis questions xlhome contact us xl free non-xl normalmail rates xlhomecs co idfb xl home dian;Positif
hi sis questions xlhome fiber please contact us xl free non-xl normalmail rates xlhomecs co idfb xl hometwitter vevi;Positif
hi sis questions xlhome please dm adi;Positif
hi sis really good home especially xlhome adi;Netral
hi sis regarding area still covered xlhome fiber network whereas exact time still could convey sis information whether area covered b;Positif
hi sis related information complaints xlhome fiber service conveyed via dm fitri;Negatif
hi sis related information complaints xlhome fiber service conveyed via message april;Negatif
hi sis related xlhome fiber service conveyed via dm huh dian;Positif
hi sis related xlhome fiber service conveyed via dm message;Negatif
hi sis related xlhome fiber service conveyed via message april;Negatif
hi sis related xlhome fiber service conveyed via message vevi;Netral
hi sis related xlhome fiber service conveyed via message yes dian;Negatif
hi sis related xlhome fiber services convey dm ordered thanks ersa;Positif
hi sis related xlhome fiber services conveyed via dm huh fitri;Netral
hi sis related xlhome fiber services conveyed via dm thanks dian;Positif
hi sis related xlhome fiber services conveyed via dm thanks ersa;Netral
hi sis related xlhome fiber services conveyed via message thanks ersa;Netral
hi sis related xlhome fiber services conveyed via message thanks yuri;Netral
hi sis rendi anything help xlhome fiber thanks adi;Positif
hi sis restu related xlhome fiber services conveyed via dm thanks dian;Positif
hi sis restu related xlhome fiber services conveyed via message thanks ersa;Positif
hi sis rifky anything help xlhome fiber thanks adi;Positif
hi sis rifqi related xlhome fiber service conveyed via dm yes thanks dian;Positif
hi sis rinda anything help xlhome fiber thanks adi;Positif
hi sis rio anything help xlhome fiber thanks adi;Positif
hi sis ririkh xlhome fiber anything help thanks adi;Positif
hi sis riski anything help xlhome fiber thanks adi;Netral
hi sis rivat anything help xlhome fiber thanks adi;Netral
hi sis rizal anything help xlhome fiber thanks adi;Netral
hi sis rizki anything help xlhome fiber thanks adi;Netral
hi sis rofkhy anything help xlhome fiber thanks adi;Positif
hi sis rudi anything help xlhome fiber thanks adi;Netral
hi sis rudianto anything help xlhome fiber thanks adi;Netral
hi sis ryan try inform installation address registration number new installation indihome service dm checked request meika;Netral
hi sis sadal xlhome one package applies customers new breeding sis detailed information please dm us thanks ersa;Netral
hi sis sandra good morning anything help xlhome fiber thanks adi;Negatif
hi sis sandy anything help xlhome fiber thanks adi;Positif
hi sis say area brother still covered xlhome fiber network information whether area covered please check adi;Positif
hi sis shinosuke related xlhome fiber service conveyed via dm thanks dian;Positif
hi sis silas xlhome fiber packages limits use let s check details thanks adi;Positif
hi sis sis anything help xlhome fiber thanks adi;Positif
hi sis sorry inconvenience anything want ask xlhome fiber service conveyed via dm vevi;Netral
hi sis sorry inconvenience experienced currently brother connected xlhome fiber customer service obstacles related xl cards please conveyed twitter facebook thank raffi;Positif
hi sis sorry inconvenience please inform details via dm help confirm xlhome team adi;Positif
hi sis sorry inconvenience regarding xlhome fiber services conveyed via dm huh dian;Positif
hi sis sorry inconvenience regarding xlhome fiber services conveyed via dm thanks dian;Positif
hi sis sorry inconvenience regarding xlhome fiber services conveyed via dm yes dian;Positif
hi sis sorry inconvenience related information complaints xlhome fiber service conveyed via dm fitri;Positif
hi sis sorry inconvenience related xlhome fiber services conveyed via message yes april;Positif
hi sis subscription please go questions xlhome please contact us xl free non-xl normal rates xlhomecs co idfb xl hometwitter adi;Positif
hi sis sukini ready sis especially watch using xlhome internet really cool thanks ersa;Positif
hi sis teguh anything help xlhome fiber thanks adi;Positif
hi sis tell experience wearing xlhome please sis;Positif
hi sis thank heart sis anything help xlhome fiber sis thanks adi;Netral
hi sis thank trust using xlhome dian service;Positif
hi sis thefpet thank information enjoy xlhome fiber service still things want ask xlhome fiber service contact us thanks yuri;Positif
hi sis time area still covered xlhome fiber let s immediately check know network area wait update thanks;Positif
hi sis time network still around jakal ps colombo widening network inform social media ig;Negatif
hi sis time still information sis certainly xlhome fiber expanding network waiting update yes hope soon covered sis adi;Positif
hi sis tintus please wait sis information announced xlhome fiber social media sis thanks adi;Positif
hi sis toto good morning help xlhome fiber thanks adi;Positif
hi sis trinuryanto anything help xlhome fiber thanks adi;Netral
hi sis wan questions xlhome contact us xl free non-xl normal rates xlhomecs co idfb xl hometwitter adi;Netral
hi sis wanda good afternoon help xlhome fiber thanks adi;Positif
hi sis wati forget join next xlhome fiber program chance win thanks adi;Positif
hi sis wendy currently area still covered xlhome fiber let s make submission additional networks area website make recommendations;Positif
hi sis wong anything help xlhome fiber thanks adi;Positif
hi sis xlhome area gresik covered;Positif
hi sis xlhome fiber service delivered via dm vevi;Netral
hi sis xlhome help adi;Positif
hi sis xlhome s twitter account sis adi;Netral
hi sis zacky anything help xlhome fiber thanks adi;Positif
hi sisil anything help xlhome adi;Positif
hi sisoneto anything asked xlhome fiber service fitri;Netral
hi skidi let s check details xlhome fiber service area covered network thanks adi;Negatif
hi slim xlhome fiber prepaid internet service using optical fiber cable directly connected customer s home via ont optical network terminal customer s home dian;Netral
hi solo related xlhome fiber services conveyed via dm dian;Netral
hi son check area time still covered xlhome fiber network information whether area covered please check adi;Netral
hi sonny sorry inconvenience currently area still covered xlhome fiber please wait update currently trying expand area hopefully area fresh xlhome fiber network thanks adi;Positif
hi sorry inconvenience accordance previous information related xlhome fiber service conveyed via dm thanks dian;Positif
hi sorry inconvenience currently xlhome internet services use fiber optic networks able cover areas continue expand network regularly also b;Netral
hi sorry inconvenience regarding xlhome fiber service conveyed via dm help checks thanks;Netral
hi sorry inconvenience regarding xlhome fiber services conveyed via dm help;Netral
hi sorry inconvenience regarding xlhome fiber services conveyed via dm thanks dian;Netral
hi sorry inconvenience regarding xlhome fiber services conveyed via dm yes dian;Negatif
hi sorry inconvenience regarding xlhome fiber services conveyed via message thanks dian;Positif
hi sorry regarding xlhome fiber service conveyed via dm dian;Netral
hi space anything asked xlhome fiber service dian;Netral
hi srforpeople related xlhome fiber services conveyed via dm thanks dian;Netral
hi sri good afternoon please someone asked xlhome fiber thanks adi;Netral
hi still things want ask xlhome fiber services contact us adi;Positif
hi strawbaby currently xlhome fiber already jogja check udpaten details area covered adi;Negatif
hi subscribe xlhome services install apartment;Positif
hi subscription period xlhome fiber month adi;Netral
hi sugiartono anything help xlhome adi;Positif
hi sunshine related xlhome fiber services conveyed via dm dian;Netral
hi suryana currently xlhome internet services use fiber optic networks able cover areas akbar also know input address website order data;Positif
hi suryo anything help xlhome adi;Positif
hi suta xlhome fiber service uses router device access hotspot data router cellphone adi;Positif
hi sutrisno anything asked xlhome fiber service thanks dian;Netral
hi swanton anything help xlhome adi;Netral
hi sweet potatoes check area time still covered xlhome fiber network information whether area covered please check adi;Positif
hi syahrani anything help xlhome fiber thanks adi;Netral
hi syamsul anything help xlhome fiber thanks adi;Positif
hi syamsul check bandung area already coverage xlhome fiber sis unfortunately arrived syamsul s address check update yes sis wait expansion adi;Netral
hi sychonix check area time still covered xlhome fiber network information whether area covered please check adi;Positif
hi tan anything help xlhome adi;Netral
hi taufan related xlhome fiber service conveyed via message huh dian;Netral
hi taufik related xlhome fiber services conveyed via dm dian;Netral
hi taufiq anything asked xlhome fiber service dian;Positif
hi taufiq related xlhome fiber service conveyed via message yes dian;Negatif
hi teguh related xlhome fiber information conveyed via dm fitri;Netral
hi tessa related complaints xlhome fiber service conveyed via dm fitri;Positif
hi thank anything asked xlhome fiber service dian;Positif
hi thank trust using xl home service regarding xlhome fiber services conveyed via dm thanks dian;Negatif
hi thata related xlhome fiber services conveyed via dm yes thanks dian;Positif
hi thea anything help xlhome adi;Positif
hi thea anything help xlhome fiber adi;Positif
hi thitipoom anything help xlhome fiber adi;Netral
hi thoha thank enthusiasm currently xlhome fiber expanding network area related thoha help us filling data link;Netral
hi thorfin anything help xlhome adi;Negatif
hi tita related xlhome fiber services conveyed via dm dian;Netral
hi titania anything help xlhome adi;Negatif
hi titzar sorry regarding xlhome fiber service conveyed via dm dian;Positif
hi tiyayara related xlhome fiber services conveyed via dm dian;Positif
hi tomy anything help xlhome fiber thanks adi;Netral
hi toro anything help xlhome adi;Netral
hi toro still things want ask xlhome fiber services contact us adi;Negatif
hi tri inform area still covered xlhome fiber network information whether area covered please check yes raffi;Netral
hi tunendra inform pontianak area yet covered xlhome fiber network information whether area covered please check yes raffi;Netral
hi ucal anything help xlhome adi;Netral
hi ucal related xlhome fiber services conveyed via dm thanks dian;Netral
hi uciha isp can t access netflix sis change xlhome oops adi;Netral
hi uding anything asked xlhome fiber service dian;Netral
hi uding related xlhome fiber services conveyed via dm dian;Netral
hi uffiq else surf free month let s subscribe xlhome information visit website dm thanks amalia;Netral
hi ulya sorry inconvenience regarding xlhome fiber service conveyed via message;Netral
hi umar anything asked xlhome fiber service fitri;Negatif
hi una check area brother time still covered xlhome fiber network information whether area covered please check wait update adi;Negatif
hi unay good morning thank still things want ask xlhome fiber service contact us adi;Netral
hi used xlhome mbps planned upgrade mbps bis whether info;Netral
hi val let s inform full address via dm help check willingness xlhome fiber network thanks adi;Positif
hi vanya thank subscribing xlhome fiber questions xlhome contact us xl free non-xl normalmail rates xlhomecs co idfb xl hometwitter adi;Netral
hi vid related xlhome fiber services conveyed via dm dian;Netral
hi viky anything asked xlhome fiber service dian;Negatif
hi vina anything asked xlhome fiber service dian;Positif
hi vira anything help xlhome adi;Netral
hi virtual reply dm please;Positif
hi vishnu sad look forward quizzes xlhome fiber adi;Netral
hi vitatituteto anything asked xlhome fiber service dian;Positif
hi wahyu installation xlhome fiber paired areas covered xlhome fiber tissue currently expanding area area hope future reach area;Netral
hi wahyudi anything help xlhome fiber thanks adi;Negatif
hi wahyudi apologize according previous information related xlhome fiber service conveyed via dm help thanks dian;Positif
hi wait expansion xlhome fiber tissue adi;Netral
hi wandijoell anything help xlhome fiber thanks adi;Netral
hi want ask sentul city area bogor regency west java xlhome cover yet;Netral
hi want subscribe xlhome procedure;Netral
hi wants ask use internet per month xlhome limited much giga unlimited;Netral
hi weska xlhome fiber package services quota limits let s check product details thanks adi;Netral
hi whazap informed advance yes full address via dm based name housing complex road block rt rw house number help check whether area covered xlhome network dian;Netral
hi whid help check address covered xlhome fiber network information whether area covered please check yes dian;Positif
hi widi related xlhome fiber services conveyed via dm dian;Positif
hi widya else surf free month let s subscribe xlhome complete information check area website dm thanks amalia;Netral
hi widya related xlhome fiber services conveyed via dm thanks dian;Positif
hi wildan anything help xlhome adi;Netral
hi win check area time still covered xlhome fiber network information whether area covered please check adi;Netral
hi wira let s check service information areas covered xlhome fiber thanks adi;Netral
hi wisely connection please wait update expand xlhome fiber network area currently expanding network area hopefully immediately reach location wisely thanks adi;Positif
hi worry xl home really unlimited kuta limit else free free internet let s subscribe xlhome information go directly website directly dm thanks amalia;Netral
hi xlhome complaint followed xlhome technicians arrived earlier internet returned normal;Netral
hi xlhome fiber packages included one ont optical network termination device stb set top box devices internet package price xlhome package mbps ad;Netral
hi xlhome fiber tissue disorder sleman area;Positif
hi xlhome fiber use quota network uses fiber optic huh adi;Netral
hi xlhome network jagakarsa yes lemodd really smalemm even though quota many please please minnn;Netral
hi xlhome service applied fup;Positif
hi xlhome subscribe package speed mbps get promo month free mbpstp fact average number mbost;Positif
hi xlhome thanka since afternoon condition normal;Netral
hi xlhome thanks;Netral
hi xlhome used around land abang apartment boulevard;Positif
hi xlhome want ask help home can t internet second red lights blinking i m new object;Netral
hi yad let s visit information services xlhome fiber offers thanks adi;Netral
hi yafi let s check information xlhome fiber service products offer thanks adi;Positif
hi yafi let s subscribe xlhome watch netflix relaxing directly tv adi;Negatif
hi yan related xlhome fiber services conveyed via dm thanks dian;Netral
hi yani related xlhome fiber services conveyed via dm dian;Positif
hi yd help xlhome adi;Netral
hi yemima sorry inconvenience regarding xlhome fiber services conveyed via dm yes dian;Netral
hi yenny related information complaints xlhome fiber service conveyed via dm fitri;Netral
hi yes thank enthusiastically thanks annisa;Netral
hi yks questions xlhome contact us xl free non-xl normal rates xlhomecs co idfb xl hometwitter adi;Negatif
hi yoes anything help xlhome adi;Netral
hi yogacholandha related xlhome fiber services conveyed via dm thanks dian;Netral
hi yohan know anything anything help xlhome fiber thanks adi;Netral
hi yonatan anything help xlhome fiber thanks adi;Positif
hi yopie anything asked xlhome fiber service fitri;Netral
hi youcim anything help xlhome adi;Positif
hi yuda address details please convey via dm quota xlhome fiber quota limit certainly comfortable worried quota runs thanks adi;Netral
hi yuda related xlhome fiber services conveyed via dm thanks dian;Positif
hi yudha apologize inconvenience regarding xlhome fiber services conveyed via dm thanks dian;Positif
hi yudha good morning help xlhome fiber thanks adi;Positif
hi yudhistira currently xlhome fiber already available east jakarta let s inform address via dm help check network readiness thanks adi;Netral
hi yudho questions xlhome contact us xl free non-xl normal rates xlhomecs co idfb xl hometwitter adi;Netral
hi yudi anything help xlhome fiber thanks adi;Negatif
hi yuhuuu football fans watch favorite leagues videos xlhome dian;Netral
hi yunda currently pondok ungu permai area covered xlhome fiber information whether area covered please check wait update thanks adi;Netral
hi yung help xlhome adi;Netral
hi yupa anything help xlhome fiber adi;Netral
hi yupa let s subscribe xlhome watch netflix relaxing directly tv dian;Positif
hi yusrlry let s check information services xlhome fiber products offer thanks adi;Netral
hi yusuf sorry inconvenience regarding xlhome fiber services conveyed via dm thanks dian;Netral
