Tweet;klasifikasi
a xlhome;Negatif
aaaa ak lom read question last night xlhome bapukkk;Netral
aaaa xlhome gblk;Netral
aahbjjjakan internet xlhome strong;Positif
able entrusted problem even though even though plaza jatinegara parents already resentful can t convinced considering double xlhome anyway;Netral
absorbed tomorrow change xlhome;Negatif
accordance conveyed said said xlhome team please detailed information via dm adi;Netral
accordance previous information related xlhome fiber services conveyed via dm dian;Netral
accordance previous information related xlhome fiber services conveyed via dm yes dian;Netral
accordance previous information xlhome fiber packages fup limits adi;Netral
according anyway region lives get reach providers like initially asking xlhome reach biznet etc eh instead indihome well already rotten alternative exist;Positif
according cs word maximum devices connected maximum device network true like;Netral
according previous information details related xlhome conveyed via dm mala;Netral
activate ipv use xlhome fiber;Positif
actually many choices cbn fibernet xlhome still infrastructure expansion;Netral
ad uses xlhome;Netral
add coverage area pugeran dong min;Positif
add gawean;Positif
add xlhome;Netral
add xlhome option haha;Netral
additional area covered xlhome come area covered fortune list xl home lgg mas sales gaperlu smart tv xl brofo android tv box subscription watch netflix let s register;Positif
additional docks xlhome already uses fiber optic quality inet much better fm probability inet trouble rarely dock sy area gresik long th uses trouble cm x;Netral
admin afternoon xlhome fiber internet died cibinong permata park location please check dm details thanks;Positif
admin bro complained via xlhome email come complement can t make gb xl quota one viber still responses wait min;Positif
admin cibe asked resign reading;Negatif
admin come xlhome users can t access twitter;Netral
admin got xlhome bill via email want pay bill available please info admin;Netral
admin handil bhakti xlhome area please repair router loses red;Positif
admin morning xlhome slow cibinong area customer id please check dm thanks;Positif
admin want complain signal disorders xlhome;Negatif
admin want install xlhome tp area covered;Netral
admin wants ask netflix xlhome like;Netral
admin xlhome area handil bhakti south kalimantan damage starting morning los kedek red complex please handle immediately;Positif
aduuduu pii replace xlhome recommendation indihome possessive;Positif
advantages first media quite stable compared xlhome;Positif
advice immediately looking xl sales respective cities also asked cs said home area included coverage area even though xlhome pole home checked sales friday afternoon monday morning monday morning installed;Netral
advice install mko xlhome nder fup safe use end month;Netral
aera pringles aera xlhome;Negatif
aera xlhome;Netral
aespa xlhome;Netral
afternoon ask xlhome wireless unlimited prepaid amp budling buy compared xl go settign xl outlets;Netral
afternoon brother xlhome fiber connection really connection southern tambun area bekas;Netral
afternoon information applications currently xlhome thank;Netral
afternoon ipot android pc can t connect even though internet smooth using xlhome;Positif
afternoon sir sir went house red cable broke sir fo cable prone break sir;Netral
afternoon sis filled xlhome gb quota able get active period additional days adds days huh;Netral
afternoon sis want ask product xlhome already cilegon-banten please info tks;Netral
afternoon xlhome connection afternoon may helped;Netral
afternoon xlhome gowa region beating stall lights thanks;Netral
afternoon xlhome internet super slow morning please help already dm thanks;Netral
agets cg cbn myrepublic firstmedia transvision xlhome live cen ne promo;Netral
ah bgt xlhome anjng;Netral
ah i m bekas yet cover;Positif
ah unlucky want watch home tournament eh turns dying quota wants buy another quota week xlhome come welp;Netral
ahahahaha really usually xlhome;Positif
ahahahahha republic kaloga xlhome biznet clear;Netral
ahh xlhome rainy season really bad;Netral
ai recommended xlhome know yet;Netral
ai xlhome s experience stable qualified mbps package minus might cable tv package streaming like indihome already channel like metong suddenly late time teng maintenance maybe;Netral
ak child xlhome nder;Positif
ak indihome user bkn xlhome gtw xlhome ak ksi knows indihome smoothly dagjal;Netral
ak kmrn tab bs hp sm laptop z xlhome;Netral
ak make xlhome;Netral
ak team xlhome;Negatif
ak xlhome;Netral
ak xlhome good;Netral
akar ax xlhome looking many many;Netral
alaaah xlhome video;Netral
alah loyal biznet myrep xlhome entering also definitely replace;Positif
alhamdulilah xlhome smoothly victorious;Negatif
alhamdulillah already used xlhome safe;Netral
alhamdulillah broke indihom using xlhome;Netral
alhamdulillah thanks xlhome s sister fixed;Positif
alhamdulillah today city make report xlhome network disorders try;Netral
alhamdulillah xlhome smoothly;Netral
allah long disturbance xlhome quota finished cokkk;Netral
allah xlhome bad;Positif
allahu great biznet xlhome gorontalo immediately pull;Positif
allo xlhome;Netral
almost every day arrival xlhome sales turn install week installed technician x survey location even phone time cs bit stretchy saying home area can t install clearly front house xlhome pole;Positif
almost internet hour cs say please wait;Positif
almost month install xlhome fiber response help xlhome brother;Positif
almost sunday internet xlhome house broke please add address jalan pulau bangka denpasar;Negatif
alo want additional internet using xlhome package unlimited;Netral
already almost month ago filling personal data vent twitter dm confide cs cs e mail well opened also shading central xlhome flooded can t;Positif
already buried month ago arrived yet xlhome;Negatif
already contact sales rep myrep cbn biznet xlhome oxygen withdraw cables;Netral
already dm also info improvement solution xlhome;Positif
already dm response xlhome severe promos gedein said super fast super slow;Positif
already entered area house follow xlhome info cover can t put area house back steamer ui hanging;Positif
already felt otw moved xlhome;Positif
already fighting twitter u xlhome;Positif
already fill form responded well played xlhome;Netral
already gave additional charge without notice consent customers even interrupted going since wib hours;Negatif
already given explanation dm cs xlhome usual fiber infrastructure disorder area around house;Negatif
already guessed soan blasphemed indihome turns xlhome;Positif
already increasingly arbitrary xlhome;Netral
already indeed xl network good know xlhome;Netral
already late error;Positif
already lot kayapa shoes;Positif
already migration process fm xlhome ears hear news bird service worse;Netral
already monday monday xlhome service yet entered new orchid gdc;Negatif
already move xlhome smoothly victorious indihome firstmed wkwk;Negatif
already moved;Netral
already moved xlhome;Netral
already often complained change best answer try restart modem wait minutes later want replace xlhome said really good know going anymore would also jogja jogja boarding house also used indiehome bro;Positif
already often register home area xlhome web want hurry change xl min tired fm dead test;Netral
already psang xlhome;Positif
already pull moved xlhome;Netral
already quite lot richness beginning year rather quite open cables jogja try checking xlhome web;Positif
already register xlhome yet come said tomorrow;Negatif
already registrants want switch provider firstmediindihomexlhomecbn fibern enjoy consultation jamsudah fiber optic network consultation without fupfree installation free rental rental uniformedinfo subscription via dm whatsapp mimin yaa yaa;Netral
already rt inya xlhome san;Negatif
already songong really kmren belabeli book mulu today remembered xlhome bill stupid;Negatif
already still repeatedly even covered even though arrive house covered xlhome already tired sirah used;Positif
already subscribed xlhome kk;Positif
already switching indihome xlhome think better;Negatif
already that s tf xlhome every month fup limit long use limited home streaming youtube kids time children;Netral
already tried variety internet networks best really xlhome cheap cpt disturbance overcome hours;Netral
already try xlhome blum;Positif
already tv package sir;Positif
already used home never tried video call satisfied using;Netral
already used indihome turned xlhome cheap;Positif
already used use xlhome mba;Netral
already used xlhome safe ahaha;Netral
already using one ae bob original indihome bad xlhome fast bob;Netral
already using xlhome;Netral
already using xlhome use vpn anymore netflix buuu;Positif
already xlhome internal clock like;Positif
already year beginning beginning high mean year s promo;Negatif
already year like often trouble need use xlhome;Negatif
already year use xlhome year often network stupidly;Netral
already year using xlhome far safe maintenance network late midnight per month pay k hockey promo get borrowing android tv box;Netral
already yesterday track old conversation fail want follow exchange numbers later considered violate privacy;Positif
already yesterday wifi internet xlhome died id jl pandu sumerta denpasar bal things need asked contact us technician come soon;Positif
also aka made xlhome awikwok;Netral
also arrived chatter xlhome iconnet replace entering complex;Positif
also follow suggestions xlhome pay kindergarten also improvement time address jln kemuning b kalegowa kec somba opu gowa kab gowa sulsel;Positif
also good xlhome mbps get much;Netral
also helped xlhome;Netral
also like xlhome entering complex immediately replace indick left bangke bombardment continues bodo;Netral
also looked looking xlhome office far home;Netral
also one migrated firstmedia xlhome ces wkwkwk;Netral
also sometimes like wifi xlhome;Positif
also tambun bekas xlhome internet los admin admin unclear;Positif
also use xlhome unstable;Netral
also used make xlhome emang dick indihomo;Positif
also want bang mah area still indihome xlhome area parents bad indihome yet;Positif
also want xlhome nihhh;Netral
also xlhome;Netral
alternative dr indihong may mnc play first choice ulg interested xlhome;Positif
although provision red still hope blue xl pole used ordinary bts front house connected xlhome g;Negatif
always report know disturbance never fixed directly fact tell staff educate complaining customers understand incompetent shame;Netral
aman xlhome jrang drama si;Netral
amazing first media ogut problematic day clear network complex started switch myrepublic xlhome moment want go join;Netral
aminnn xlhome let s friendly;Netral
amnyink xlhome;Netral
ampe scolded iqbal xlhome;Netral
amplaz tok guda south gpp xlhome murcekk waswus bar cable installation village;Negatif
ancient times clean wonder customer running neighbor s provider;Positif
android ios user n desktop pc yes boss stb android semcam xlhome indihome nuwun;Positif
android tv sony stb xlhome smoothly victorious;Netral
angel area yo bajigur wkwk;Netral
angg xlhome smooth interference hehe;Netral
angry xlhome wifi can t used eh turns tutorial diyutub effective mon maap xlhome already every day bacotin akwkakwk;Positif
anjg delicious see vma tweets zoom college offcam tb written internet connection unstable really xlhome;Netral
anjg xlhome;Negatif
anjim xlhome ngapasi;Netral
anjir ga xl hp xlhome sinynya caur parahhh ugly;Netral
anjir wes knows contacting cs e tour network like indihme xlhome especially yes home;Positif
anjrit xlhome crashed;Netral
annoyed say rudely vs xlhome story long;Netral
another internet macem biznet cbn xlhome wants asu complex;Positif
answer a xlhome;Netral
answer hi dedy sorry unstable signal constraints complete following info xl users location experience thing maya wait data thanks g cpe;Netral
answer xl xl priority xlhome axis;Netral
answer xlhome;Positif
answer xlhome sure;Positif
answer xlhome sure i m home using xlhome good rarely interference try using xlhome one;Positif
answer xlhome sure proof home using xlhome good rare disturbance try using xlhome;Netral
answer xlhomejika wrong please forgive forgiving everything;Netral
anyone asked xlhome fiber go directly us thanks adi;Negatif
anyone contact people work xlhome south kalimantan;Netral
anyone ever experienced xlhome cs service insecure sukur xlhome employees help know else complain xlhome connection constraints already reported cs already middle school today told wait mgkn smp lebaran horse;Netral
anyone ever used xlhome like interference;Netral
anyone give input among internet provider good xlhome mncplay first media indihome need already subscribed want try respect customers;Netral
anyone home using xlhome stable plan replace provider;Negatif
anyone know xlhome slow;Positif
anyone sales xlhome area kotagede surrounding;Netral
anyone use xlhome;Positif
anyone use xlhome cere area review;Negatif
anyone use xlhome error also home especially suburbs mks alias sudiang;Netral
anyone use xlhome good;Positif
anyone use xlhome internet;Netral
anyone use xlhome kemang pratama area stagnant;Positif
anyone use xlhome okay;Netral
anyone use xlhome recommendji mks;Netral
anyone uses wifi xlhome want ask dungg;Netral
anyone using xlhome;Netral
anyone using xlhome bpk want change indihome xlhome xlhome good;Netral
anyone xlhome sales contact please dm thanks;Netral
anyone xlhome technician contacts dm please;Netral
anything asked related xlhome fiber service fitri;Netral
anything asked xlhome fiber service dian;Positif
anything asked xlhome fiber service fitri;Positif
anything asked xlhome mala;Netral
anything help xlhome fiber thanks adi;Netral
anyway shoutout xlhome dh g trouble jan;Positif
aowkaowkaowk try last night xlhome ga dick;Negatif
apaji xlhome every morning disturbance continues;Netral
apart xlhome good ask;Negatif
apkh xlhome bestie;Positif
apologize inconvenience rama felt regarding matter helped convey xlhome fiber team wait update thanks adi;Netral
apologize inconvenience sis related xlhome ip settings using dynamic private ip vevi;Netral
app ne gawan fb opo raenek grandma call data uploaded braids stream e dadi ping e duwur jar change connection inet koyo nexmedia opo xlhome;Netral
appreciation tweet mas mas xlhome nimbly coming house los modem lights red connected last night morning bro came right away;Netral
aqel custom trying first price turbo expensive friend speed;Netral
area affordable xlhome try xlhome;Netral
area also xlhome signal;Positif
area can t installed xlhome;Negatif
area container entered xlhome suggest installing xlhome;Positif
area covered try xlhome help;Positif
area covered xlhome certain areas rb mbps promos access cable tv channels help ag;Netral
area ngab;Negatif
area nty mncplay pretty cheap myrepublic fast xlhome also said good speed;Negatif
area still covered xlhome fiber network installation cannot done information whether area covered please check adi;Netral
area teng much;Negatif
area west jakarta good right;Negatif
area yet exist yet covered xlhome network;Positif
areas south jakarta already covered xlhome fiber network sis informed full address based name housing complex road block house number;Netral
ashamed employees mr gunarto hrd pure company ouch concerned xlhome employee stupid deliberately money;Netral
ask area know xlhome cover quota system;Positif
ask dm xlhome lord like;Negatif
ask enter kesamarinda;Positif
ask help error sunday afternoon one cares please please;Netral
ask help xlhome lg disturbance assisted technician bwt kermh cibinong region west java;Negatif
ask mirah xlhome promo;Positif
ask xlhome fiber list jl pulo sirih selatan blok ae galaxy park housing south bekas district bekas;Netral
ask xlhome times already cheap area;Netral
asked account account xlhome;Netral
asked area covered yesterday saw covered bandung regency cicalengka checked west bandung regency part cover context xlhome coverage area;Negatif
askrl guys wifi network good fm xlhome huh;Positif
askrl plus minus using xlhome sis;Netral
askrl using xlhome wifi installation long time register;Negatif
assalamualaikum morning morning morning let s start today s activities activities home xlhome ready accompany;Netral
assalamualaikumasudah december tv box promises installation talking;Netral
assisted ut xlhome registration process kk tks;Netral
asuu mid match instead mbadut xlhome dick;Netral
asyncronus link mas bandwidth ratio meaning bandwidth upload download replace using xlhome fiber ratio hoho;Netral
attractive promo xlhome sis;Positif
august contacted xlhome scheduled install august technician came day notification regarding matter;Positif
avi uses xlhome;Netral
awaited min red doan wait arrival mupdhl already treated minho cibitung think tea entered metland;Netral
awwehh kepap tbtb joined slow xlhome;Netral
axiata also wants live indihome using xlhome;Positif
axiata pekant home services medan visit;Positif
axis government quota tsel wifi home asa hndk beganti xlhome ja bjrn lets bnrrr;Positif
ay viu play xlhome;Positif
ayan km disturbance want xlhome;Positif
ayangee;Positif
ayoo replace xlhome;Positif
ba xlhome;Positif
bacot indihome xlhome choice;Netral
bad indihomem still little better xlhome;Netral
bad narogong xlhome republic biznet also trapped indigo;Netral
bad xlhome;Positif
bad xlhome rb-an never told restart router;Negatif
bae subscription broken myrepublic dak xlhome;Netral
baekhyun made indhimoe kek xlhome;Netral
bagus indiehome xlhome;Netral
bagus indihome xlhome;Netral
bagus indihome xlhome anyway;Netral
baguuuss xlhome kencamm murehh mbps since cover slow;Netral
balifiber nodded oxygen biznet myrep cbn xlhome mncplay indosat gig pass passing yak besides indihome fm bapuk bapuk bapukkk;Positif
balifiber oxygen myrepublik mnc xlhome;Netral
bandung xlhome;Netral
bang turn xlhome netplix;Positif
bangke indeed xlhome earlier network missing;Positif
bangke really want register xlhome still house enclosing coverage damn;Positif
bangke xlhome;Positif
bangke xlhome said fiber optical little stubbling;Positif
banjarmasin still use area xlhome;Positif
bantul live indihome;Netral
banyk come providers bro indicate make annoying indhome use providers;Netral
barudak xlhome boss anti blockir blockir clab;Netral
basically xlhome fiber service used wifi home xlprior postpaid xl card service adi;Netral
becoming customer xlhome already sorry;Netral
beginning expensive used xlhome;Netral
believe rain xlhome slow forecast weather bmkg;Negatif
besides indihome enek fm myrep biznet xlhome;Netral
besides indihome sm firstmedia wifi else good one xlhome biznet reached home area;Netral
best mnc biznet xlhome also interesting;Negatif
bete internet home slow want super fast internet access home time turn xl home need reason trivians buy directly;Netral
bete really xlhome lg trouble class top floor gr gadak room signal km emg;Positif
bete xlhome arrived yet failed leave indihome;Netral
better biznet xlhome regretting;Positif
better change xlhome already hun;Positif
better change xlhome wkwk;Positif
better indihome xlhome huh;Negatif
better install wifi tv box entertainment xlhome;Netral
better use first media xlhome much cheaper forget indihumz;Netral
better use xlhome wkwkwkw;Positif
better wico instead waggai xlhome improves;Positif
better xlhome firstmedia;Positif
bgt really willing stop indihome subscription xlhome alternative;Positif
bgt xlhome defects;Netral
bgt xlhome service enough year wifi loss almost x already wifi loss day technician dtg complaints responded pdhl pay bills i m sorry replace indihome xlhome disappointed;Positif
bilank pke xlhome;Positif
birthday like xlhome signal home smooth;Positif
bismillah answer xlhome;Netral
bismillah indonesia;Positif
bismillah xlhome i m already sane amen;Netral
biznet ama xlhome kek lbh cheap drpd indie;Netral
biznet bad xlhome;Negatif
biznet boarding house rmh xlhome;Positif
biznet brp brp ris cave xlhome mbps;Negatif
biznet can t xlhome entered scope area want;Netral
biznet come wait xlhome put pole near rmh long time like waiting sea live;Netral
biznet dabes anyway yes able xixi xlhome new;Positif
biznet myrep xlhome;Netral
biznet myrep xlhome like longer big expansion;Positif
biznet myrep xlhome want netflix indihome important;Positif
biznet myrep xlhome wifi enter area house left indohome know;Netral
biznet myrepublic amp xlhome good;Netral
biznet myrepublic xlhome;Positif
biznet myrepublic xlhomekalo ga coverage itumncplay;Negatif
biznet oxygen cbn xlhome transvision myrep preparing;Negatif
biznet sm xlhome ka;Positif
biznet want enter village xlhome hahaha;Netral
biznet xlhome;Positif
biznet xlhome bang;Positif
biznet xlhome great;Netral
biznet xlhome oxygen mnc someone wants enter complex filesiadia really inet;Netral
biznet xlhome pretty stable disturbance yes resigned;Positif
bless xlhome;Positif
blimbing akeh choice cbn xlhome wes enter;Positif
blm lg younger siblings online online zoom contents gb quota used day zoom x day dm ignored already xlhome disappointed;Netral
blum seems like lyrics xlhome anyway later one set;Netral
bm makes xlhome area covered;Negatif
bment biznet citranet firstmedia xlhome si want moveon spdy;Netral
boat huh hahahaha already proposed myrepublic firstmedia mncplay biznet xlhome rejected sob;Netral
bogor area expanded xlhome area can t even though road covered xlhome;Positif
bored mr dm dm man sodorin sop asked cs one knows mantion director xlhome delicious;Positif
boss;Positif
boss xlhome jogja right sign;Netral
bot talking bot phone cs still wrong waiting clock turn pay paid days reason damage broken fiber long time since broke subscribe;Netral
bought mpdem xlhome finally;Netral
bought used xl home router dr tmn turning turned could log entering no yg tried use prime xl combo lite gb quota login myxl question buy xlhome package;Netral
boyolali xlhome sis;Netral
bpk area kog xlhome website surabaya;Positif
bpp xlhome bkvnet yet able name indigo stable network;Positif
brebes central java region covered xlhome network;Positif
bro already like;Netral
bro enter xlhome service thousand housing mustika griya permai complex cindai alus martapura south kalimantan mpet border banjarbaru city martapura equal range services city banjarbaru dong towards balitan amaco;Positif
bro office cere firstmedoi always like years finally moved xlhome;Netral
bro play connect koneksiny use telkomsel g xlhome;Netral
bro please expand reach jalan kaliurang km sleman-jogja instead twitter account k followers instsgram k follower network arrive office month promote xlhome free;Netral
bro want replace xlhome network plosok wkwkwk;Netral
bro xlhome internet stable even though use home;Positif
brp bandwidth bede xlhome low indi;Positif
bru dngr xlhome wkwkkw;Positif
bruuu use xlhome mbps download upload still much cheaper indihome mbps download uploads lame quality also better better xlhome x fold lmao even though xlhome good gtedicatedyha;Negatif
btw aera xlhome listen;Netral
btw happy congratulations marriage sakinnah mawaddah warrohmah;Netral
btw love indihome one move cbn xlhome;Positif
btw use xlhome;Negatif
btw xlhome disturbance thanks;Negatif
btw xlhome replacement i m afraid supporting housing average indohomo;Positif
btw xlhome seriously asking jing;Negatif
buffer terosss xlhome entered replace;Negatif
building ak masang xlhome ni original kdd disorders skali also netflix access kwa;Negatif
bumi cilebut bogor bumi housing want install xlhome block a-z block ac please expand network put pole bored internet service next door;Netral
bungul;Netral
buy data xlhome sometimes pig signal;Negatif
buy fiber optic cable xlhome network arrives home;Positif
buy kidney selling first;Netral
buy load balancer router install indihome xlhome one dead still safe river dead together;Negatif
bye indihome hello xlhome;Positif
bye indihome xlhome come;Positif
byebye indihome mbps welcome xlhome mbps price mahal;Netral
cable tv internet unlimited hadiarto nur eka putra kom marketing team xl home price picture includes vat stamp stamp;Netral
call customer service xlhome want lift find number google;Netral
came bring good news pay xl home bills passing immediately get cashback rp thousand use blibli-xlhome voucher code see pretty good right promo valid number october;Positif
came change xlhome oath;Netral
can t access xlhome router dashboard changing preferred dns dhcp setting dns nawala solution sy cb sets manual ip client access dashboard router without dns using dns google still can t access automatic router redirect xl home com;Negatif
can t access xlhome s internet report via email customer service xl home morning solution;Netral
can t dm try dm first;Positif
can t even listening spotify i m gaming xlhome;Positif
can t get xlhome ip;Negatif
can t join watching xlhome;Negatif
can t mean;Netral
can t nder minimum monthly subscription contract indihome know xlhome;Positif
can t open netflix cellphone tv connected wifi xlhome;Positif
can t sleep finally fiber network entering bakkramat s house know whether provider still mystery tip caga blue-white-blue cable;Negatif
can t use xlhome xlhome enter coverage area min;Netral
can t wifi house used please help;Positif
cant relate rangorang complain indihome home using xlhome far good murmer wkkw;Netral
cape really sm xlhome lg lg mlu disorder ngapasiiikkk wonder;Netral
careful clearance use xlhome;Netral
careful using service name used subscribe ask closed even complicate want contact owner boarding house xlhome installed colleague;Netral
caruk already;Netral
cashback cashback cashback pay xl home bills able get cashback rp guys way really easy enter promo code xlhome-sept payment period number september;Positif
cause xlhome home slowing told pay bill yes;Netral
cbn biznet mmt acenet xlhome oxygenid stream i m mistaken depending coverage area anyway;Positif
cbn pole network xlhome bg wkwkwkwk;Netral
cbn try checking bal fiber cbn xlhome;Netral
cbn xlhome;Netral
