Tweet;klasifikasi
network disorder sidoarjo min morning since morning xlhome can t connect internet;Positif
network enter housing harmony cluster tarumajaya bekas;Positif
network like anyggg collapsed tower ck;Positif
network problems since date reporting date response date;Positif
network really bad want move direction;Netral
network smooth light bill let s use xlhome;Positif
network yet maybe use orbit xlhome;Netral
never heard xlhome indihome g bs netflix;Positif
never used firstmedia internet connections connected later week moved xlhome first week still stable cable tv gada;Positif
never used xlhome money taken away sales firstmedia also area;Negatif
new banjarmasin rich pang ak older banar dah hndk xlhome;Netral
new housing indihome xlhome watching iflix catchplay first;Positif
new number day ago taken wkwkwk used xlhome moon meaning hopeful decline;Positif
new package buddy efficient wa ask first;Netral
new slide web checkidot;Positif
new slide web web cekidot;Positif
new xlhome customer running month received id payment bills know name registrant crisyanto nurhafidh e-mail address crisyanto nurhafidh com thank cooperation;Netral
new xlhome new customer day mbps sometimes internet irfandhy almt bogor new b help repair using wfh tks;Netral
news august earlier appeared notif someone asked xlhome;Positif
news selular award best home internet category award;Negatif
ngeelin bat already ah xlhome dead life dead bored what s life;Negatif
ni earlier mutual attach indihome disorders move provider rich firstmedia biznet xlhome citranet;Netral
ni w bjm using xlhome;Positif
ni wifi xlhome kek pigs bgt anjjj slow;Negatif
ni xlhome;Netral
ni xlhome matter apas already middle night always interrupted;Positif
ni xlhome ngape sik middle night using errors;Netral
ni xlhome ngatau bsk deadline;Negatif
ni xlhome really right network tv router lights red ah really duty;Positif
niate wis suwe ra passed path e xlhome jane good;Positif
nice info price even wooow info xlhome;Positif
nie uses xlhome wifi error;Netral
nie xlhome kmuankh sm twt;Positif
night actually died can t continue work cs complaint never response hadeuh;Netral
night customer xlhome house currently red los network disorder fix soon;Netral
night min ask xlhome info please;Positif
night please reply dm xlhome inet connection dead almost time thanks;Negatif
night please want u wil hut chili udik south tangerang covered xlhome thank;Netral
night sis else disorder sis got restart ont come can t get internet connection please help check sis thank;Negatif
night want ask come wifi house died morning around hour turned restarted many times router also pondok cikunir indahno housing customer;Negatif
njajal xlhome fm nal;Netral
njajal xlhome gung jare luweh jozzz cheap tour;Netral
nongki nah lawas kd;Negatif
nontom mukbang hour looking cases like every hour time disruption;Netral
noon network still loss woyy pondok jaya area depokkk tomorrow change xlhome;Netral
nop xlhome goes;Netral
normal means allocation bandwidth use fair xlhome package mbps allocation peak bandwidth number mbps cheating good good faith people need wfh class pny solution;Netral
notification snoretoast goodbye group made smile i m waiting others internet home realtime protection windows detect notifu snoretoast;Netral
number xlhome can t buy broadband package okay package running intention extend choice package;Positif
number xlhome people balifiber mncplay stroomnet icon use fm lord even though number indi especially know former people contract rented sodara cave cable fm revoked wkwk;Netral
nusaloka myrepublic xl home know afraid moving neighbors okay using myrepublic xlhome honestly focus myrepublic xl home wait year;Positif
nyobo xlhome nder;Positif
nywa bis money;Negatif
nywa pang gonggong;Positif
oalaah tak kiro liane wkwk change wae citranet po xlhome wkwkw;Positif
oalahhh maybe yes every day used felt xlhome april can t time can t anymore mean april right;Positif
oath better customer service indihome lifetime never provided severe xlhome;Netral
oath close person sad sad;Netral
oath xlhome invites really nervous;Netral
obstacles come still connect internet morning evening;Positif
obviously xlhome start getting speed mbps tvbox ask dm;Positif
offer quickly complaint hahaha gmn;Netral
offer video xl home sales friends makassar fall xl home makassar remain best sales xl home makassar passing;Netral
office area covered xlhome network yet;Netral
officer sing serves installation xlhome ra;Positif
official account jogja help psang xlhome;Positif
often interference finally using indihome reports responded application update uses chatbot luckily another alternative even though xlhome also good still good indihome strength indihome everywhere;Netral
often place xlhome entered also incident like means suspicion right indihomo healthy isps can t enter block;Negatif
often uncomfortable watching xlhome tv inevitably follow livestream;Netral
ogitu doc really different choose xlhome try asking customer references near area doc prove survey spirit;Netral
oh already outside local government huh pretty cheap fast jat xlhome tp graha entered hahaha like isp told restart modem;Negatif
oh brother xlhome cmn read ajasi;Positif
oh know they re bumn time change use xlhome works fine take long time even download games like call duty phone promotion think sharing what s good good right;Netral
oh maybe one reason wifi xlhome little slow;Netral
oh twt really error think xlhome acting;Netral
oh xlhome can t installed hiks still limited certain rts;Netral
oh xlhome maintenance;Positif
oh xlhome notto disu shitto agent;Netral
oh xlhome package;Netral
oh yes website can t accessed xlhome network another provider telkomsel access website;Netral
ohh like xlhome entertainment box gt huh tool separated gt tempting anyway tv internet long time;Netral
ohhh hahahah xlhome like working times wfh aka vacation;Negatif
oi xlhome lg zzz disorder;Netral
oiya tagged xl germany;Netral
ok okay tlong ya xlhome wifi slow jjur yesterday use wifi;Positif
ok xlhome nuhun dat;Netral
okaaay oya nitip improve quality xlhome services city bogor;Netral
okay i ll wait hopefully xlhome fyi go ahead area actually installed pole fiber optic cable activated;Positif
okay indihome move welcome xlhome;Positif
okay sis turned xlhome thx;Negatif
okay thank know info btw account unique hehe never tweeted month join fill reply xlhome hehe great middle nowhere account eventually care complaint tweet since last year tho;Negatif
okay thanks infone om;Negatif
okudah hub seller xlhome min;Netral
old candidates xlhome plus family use xl provider well h signal;Netral
old customers started get saturated much often service dies suggestions providers internet bloated area;Positif
om check xlhome coverage ogut house area;Negatif
one day offered xlhome installation offered mb mb package chose mb installing tried speed using speedtest app turned mbps speed mbps billed mbps contributions want downgrade mbps;Netral
one south tangerang using xlhome;Positif
online lectures still apply internet quota definitely run quickly run let s hurry subscribe xl home promo price starting rb already inet mbps cable tv speeds hayukk hurry list serve yogyakarta area;Positif
oooh that s ram think want try xlhome i m afraid;Positif
open internet turn xlhome;Positif
open twitter announced today national disturbance completion improvement yet known long that s conclusion cs xlhome answer call dm also replied;Netral
open twitter using xlhome picture video appear open using data smoothly;Netral
open twitter using xlhome sometimes sometimes kaga;Netral
opened xlhome long network settings android gadget changed enable private dns following guide;Netral
opinion dr services like optics fiber xlhome expanded reach fup gb month watching netflix series day runs;Netral
optical fiber pairs g g g data center indihome xlhome oxygen myrepublic;Netral
options pti gen indihome xlhome first media huh;Netral
order waiting beginning month there s cashback promo pay xl home bill blibli get cashback maximum thousand enter xlhome-juli promo code number july payment period;Positif
original ni xlhome keep alivenya reinforcement ssh left mute broken pipe swampwis;Negatif
original xlhome flop;Netral
original xlhome users guaranteed kd emotional kd lawas jd ba xlhome nh;Positif
otw moved xlhome;Positif
ouch hopefully xlhome installed house wkwkwk;Netral
ouch xlhome right;Netral
overtime mah moal aya xlhome rom;Negatif
oxygen xlhome enter reach hahaha;Negatif
package connected xlhome fiber;Netral
package fee area affordable xlhome;Netral
package hati xl home makassar mike xl home;Netral
package options offer xlhome family mbps xl home mbps rp xl home smart mbps rp costs include vat yes thanks adi;Positif
package segb xlhome sulking morning morality;Netral
page buying xlhome internet package messy can t buy package;Netral
paid mbps get thanks xlhome;Netral
paid xlhome arrears blocked come still active internet;Netral
paired provider well indihome xlhome use balader load router live bandwidth double one dies still walk lasts month;Netral
pakeee xlhome doong cheaper;Netral
pakw xlhome bang;Netral
palakau broke xlhome open twitter one smoothly strange;Netral
pan already explained miss thread myxlhome called ms maya saying network;Positif
pantes download ng omah karo download ng kosan banter ng kosan omah nggo indihome kosan nggo xlhome;Negatif
pantes response;Netral
papa blame xlhome njrt;Netral
pas attach wifi make xlhome;Netral
passing pang also banyu;Positif
patience people house uses xlhome wifi;Netral
patient last day msa wifi xlhome can t dipke ngetwit;Positif
patient mba xlhome;Positif
patient xlhome slow know unlimited ass point unlimited can t used many days today national network improvement fine long can t answer relaxed answer gives impression calming affect;Positif
patiently sm xlhome huu;Netral
pay moon die connection xlhome solution i m asking compensation;Netral
pay price xlhome fiber package sis every month vevi;Negatif
pay xlhome;Positif
pay xlhome bills installed find info pay;Negatif
payment first kecent gaca rto keeps;Netral
pcr uses xlhome good;Netral
pd recommendation oxygen sm xlhome word cs area house support sad;Netral
pemgen changed xlhome first media good;Netral
pen tenti indihome pocket friendly xlhome recommended iconnect pln anyone ever used one;Negatif
people moved provider time late user xlhome he em could;Positif
people offer xlhome house gangerti mom lgsg incitable lgsg want gnti indihome;Netral
per month right cheap anjir xlhome good;Negatif
perdana xl gb flex prices schoolgirls bonus gb;Positif
personally ask need protected come weird xlhome say necessary;Netral
pgn anyway considering often disruption p sm xlhome code think;Positif
pgn bgt ti yawla original gada used tp xlhome jele biznet reach cable pln products clear wkwk;Positif
pgn change xlhome reach home area wassalam;Negatif
pgn grateful moved indihome keinget yesterday xlhome speed destroyed ppm;Positif
pgn try xlhome;Positif
phase want open ig think thinking shame quota kosan kosan wants change xlhome long time;Positif
phone number email address address jl gang block name housing complex ruko building rt rw kel kec city complete information variety services available accessed website thanks tb;Netral
photo file come wae still connected xlhome;Netral
php-in xlhome sales covered brochures house crazy;Netral
pian make xlhome sis;Positif
picked xlhome comfortable asking break right byr make mbbbanking b c nominal already double said usually double payment next payment udhan asking refund;Positif
pig xlhome usually also sane every mute rto;Netral
pina chaotic xlhome;Netral
pioneering tegal jalan kh muchtar thabrani yet entered xlhome network;Netral
pit maneh make indihome xlhome like;Negatif
pkai xlhome aman;Negatif
pke jnt sicepat xlhome safe time;Netral
pke xlhome;Positif
pke xlhome mkny;Netral
pke xlhome sj hyunk;Netral
pkenya xlhome;Positif
place besides indihome iz xlhome entered replace xlhome;Netral
place changing xlhome;Positif
place cheaper xlhome arrive rb already mbps plus tvbox;Negatif
place providers inet wet gig xlhome tetring data package indihome competitors mediacloud wfh school children home e-learning bandwidth divided provider ready;Netral
place xlhome come;Netral
place xlhome smooth important thing cheap;Positif
place xlhome stable nder indihome cheaper mbps k month;Netral
plan install xlhome;Positif
planning xlhome fiber reaching city malang east java;Netral
planting terminal fad bititin cables experience technicians planting network easily hit citizen hoe renovation residents diverse;Negatif
playing games tv android box xl home;Netral
playing mhw etc safe huh read forum blg xlhome ugly play online ps hmm want;Negatif
playing mobile home like play application;Netral
please able wait next xlhome quiz asep winner undi nothing unfair everything opportunity adi;Positif
please anything help xlhome fiber adi;Netral
please beg help data input parties immediately handle soon possible thank contacting cs complaints experience try restart modem hopefully day fun;Positif
please check billing bill jt even though every month pay regularly receipt payment weird xlhome;Positif
please check dm amp mention xlhome wifi connection died clock responded xlhome;Netral
please check dm regarding program received via whatsapp xlhome;Netral
please check information area covered xlhome fiber network thanks adi;Positif
please check xlhome customers jalan anyelir blok tridayasakti tambun bekas kalo jam internet mbps get instead speed kbps netflix want walk hd please solution;Netral
please contact escape pulp provider;Netral
please convey details via dm help confirm xlhome team adi;Positif
please convey questions xlhome sis adi;Netral
please cooperate;Positif
please credibility yes thanks fika;Positif
please directly dm regarding xlhome fiber product thanks adi;Netral
please disappoint;Positif
please explain package please ones buy xlhome usual cellphone unlimited;Netral
please fill indonesia;Positif
please haunt already use xlhome;Netral
please help arief able convey details via dm yes considering detailed information need confirm xlhome fiber technician team adi;Netral
please help checked xlhome died morning around wib thank;Positif
please help internet wifi currently offline id pel xlhome dody pujianto;Netral
please help internet xlhome home can t access internet week made payment thanks;Netral
please help trim transverse cable dislodged front house already asked another provider xlhome firstmedia cable owned info please send technician address info bs via dm;Positif
please help xlhome arana bekas cluster area dead tlg help thanks;Netral
please help xlhome fiber internet access trouble los red light modem blinking continuously;Netral
please help xlhome network come really ugly;Netral
please info can t stb xlhome home connect changes appearance waiting good news;Netral
please info internet disruption mekarjaya area depok xlhome internet network cut;Netral
please info please admin true xlhome covering distance odp;Netral
please info submitted range xlhome area home area know access installed available even though middle city come process long;Negatif
please info west bekas area finger xlhome;Positif
please info xlhome;Netral
please info xlhome disturbance tangerang;Negatif
please inform xlhome subscription stop stop;Negatif
please make channel kotagede sick using pleaaase really msok backwards day;Negatif
please morning network cannot used;Netral
please morning right can t internet right;Netral
please myrep acc residence rejected xlhome;Netral
please network please continue;Negatif
please open xlhome coverage area btr blok jalan srigunting kel burangkeng kec setu kab bekas;Negatif
please permission want ask whether xlhome network banjarmasin region surrounding areas experiencing interference please info thank min;Netral
please provide another provider biznet myrep xlhome boarding area anjink using indihome time;Netral
please reply xlhome dm disadvantaged almost week;Netral
please sis anything help xlhome fiber adi;Netral
please solution xlhome internet lost signal;Positif
please stop billing bills cancel installation marketing need ask dm useless read either;Positif
please submit details discomfort via dm related xlhome fiber service thanks adi;Positif
please tell xlhome right;Netral
please understand xlhome want netflix n chill exam test aaa i m angry later;Netral
please use xlhome can t use;Netral
please wait expansion hopefully xlhome fiber network immediately cover area thanks adi;Netral
please wait update sis conveyed said xlhome pole adi;Positif
please without vpn wkkw review directly user;Positif
please woii come network broken makassar;Netral
please xlhome biznet myrepublic cbn plis really one reach house sad;Netral
please xlhome makassar los lamp ditlp nomor cs said number receive phone always pay bill right time problem problem response slow please solution;Positif
please xlhome network conditioned bapuk need rejuvenate cables;Netral
please xlhome please often like pay never late friendly;Negatif
please xlhome tai network;Positif
plg xlhome one fiber since joined data data could used lap dkjb-ave complained month answer patient want patient especially even though month never paid;Netral
plis xlhome make problem first;Positif
plisdong xlhome paid free;Netral
pls answer dong min xlhome trobel;Netral
pls help want tmbh xlhome quota tlpnk cs time break;Positif
pls really xlhome zoom hours please compromise yh bastard;Netral
pls xlhome ad tv stream sctv can t air;Netral
plsss xlhome cover rmh area pen moved arinda permai long time;Negatif
possible myrep oxygen xlhome biznet waiting biznet myrep enters already mapping pole honestly use firstmedia;Positif
posts using xlhome comfortable went smoothly lights dakawa lights;Netral
prank xlhome pdhl already back;Netral
prapatan entered xlhome eh rik sob already fed indohime;Positif
premiere min amazon prime video still stb xlhome;Netral
prens suggest replacing xlhome oxygen thanks;Positif
present lightning speed xlhome;Positif
present said continued xlhome team please wait confirmation adi;Netral
present xl xlhome fiber service xlhome fiber super fast internet access service using optical fiber cables also provides home entertainment products form set top boxes decoder tv;Netral
present xlhome still stages expanding network area hope might soon able cover brother s area future adi;Netral
president director fiberstar sugiharto darmakusuma said cooperation xl axiata part mission developing digitalization indonesia especially able move productive home;Netral
previously officers came house promotion x asked selfie never followed cemarren came said listed system still asked list ktp kk etc selfie ngaco what want xlhome;Negatif
price list xlhome uncle;Positif
price really expensive xlhomega call close safe children riot;Netral
private wifi troubling need indihome xlhome;Negatif
problem city yet included review good;Netral
problem internet xlhome july afternoon clarity pay can t late us complain service late come one sided banged huh waiting;Netral
problem mo compared product next door speed standard difference difference price almost quality much different speed go use crosses limit reality access internet;Netral
problem want give ticket consumers basic data also knows problem i m tired going solution;Positif
problematic xlhome wifi problematic huh want stream gda;Positif
procedure stopping complicated min still chaotic xlhome network lo;Positif
promise fake waiting boycott customers want us move disappointed empty promise;Netral
promo activity without limits indihome bandung;Netral
promo internet package xlhome fiber internet tv entertainment box internet super fast stable home includes entertainment box used areas free installation tools speed mbps unlimited fast response use limit;Netral
promo nh min new xlhome installation;Negatif
promo package heart makassar sulaweai selatan;Positif
promo pay xl home behind period june pay xl home blibli xlhome-juni promo code able get cashback rp thousand;Netral
promo please use year many money issued xlhome subscriptions promo;Positif
proud use xlhome pas meeting trouble stable;Positif
provide provider sympathy want go area network gt loyalty promo want one manage quota u home use xlhome different;Netral
provider banjarbaru still indihome xlhome started enter banjarbaru yes still whole region;Netral
provider option indihome myrepublic xlhome biznet others choose indihome;Netral
providers present provide high bandwic affordable prices nowadays info consultation coverage wa tel bandung xlhome newnormal rumahja bandung bermatibatbat;Netral
providers want slow principle say xlhome yes smoothly people still little particular area try expand next stage service ga guarantee smooth;Positif
providers wes rakyat saiki neng jogja xlhome transvision etc;Netral
providers whose cables arrive home besides indihome want move problem problem oxygen myrepublic st media xlhome mace;Negatif
psang xlhome aj;Netral
pud xlhome;Netral
put indihome coming home xlhome huft;Positif
q use xlhome fast;Netral
q xlhomejangan forgot breakfast ikoo hv gr day;Netral
quality internet getting dilapidated subscribe mbps day still able speed mbps night destroyed mbps reach definitely stopped subscribing xlhome month;Netral
questions xlhome fiber service hesitate contact us adi;Negatif
quite satisfied xlhome service year least grateful helped work daily really needs internet connection amp provide entertainment xlhome disappointed day;Netral
quota fast xlhome wifi state dead;Positif
quota finished blame original xlhome really wifi;Positif
qw pk xlhome fits good signal lum s connection cm ping playing online gemda worn lg mahals using quota based gamasih fibro village dalem using local isp radio based fall cheaper monthly;Negatif
rain ballad please xlhome work disturb first still files upload;Netral
rangerti ki randue selected area lg ono indihom tok want nyobo xlhome lg ono pole e tok rung ono odp ne;Positif
rarely use xlhome;Positif
rareti lot xlhome sek mbps hoping translucent mbps eh mung mono;Netral
rather getting upset xlhome better get cage;Positif
rather xlhome pairs;Netral
rb buy xlhome mbps change instead;Netral
read xl home serves people east java;Positif
read xl home services available medan city;Positif
reading understand finally understand xlhome;Netral
ready bot;Negatif
ready bro suwunkalo individuals biznet xlhome;Positif
ready kins anything want ask xlhome fiber service contact us adi;Netral
ready xlhome sales;Netral
really anjrit let s use xlhome;Netral
really bad bro boong also turns xlhome wow hope others get tricked;Positif
really bad xlhome;Negatif
really bad xlhome quora loaded twitter load pictures one somewhat encouraging access netflix;Positif
really buddy indihome option change myrep xlhome brush directly really savior world internet;Positif
really fast xlhome;Netral
really good bro already xlhome fast fm far behind;Positif
really good wifi lately long time make scared mingfu tomorrow use xlhome sis yul;Netral
really indihome used moving xlhome bill came rbgw know pass letter jasa want pay get civilized;Netral
really know found morning got email xlhome buldep bill would go thought would impact things even though;Netral
really live narnia called firstmedia cbn myrepublic indihome biznet xlhome gig none cover location;Positif
really outrageous xlhome sdh hours improvement action continue continue told wait told patient solution;Negatif
really podepok use xlhome often stroking chest;Netral
really sad problem rich xlhome riot;Netral
really said depe previous week indihome destroyed week friends first media myrepublic hit xlhome biznet far still safe;Netral
really slow wifi indihome arghggg good house using xlhome;Negatif
really strange xlhome rt can t rt next door i m confused trying ask others first ah myrep cbn mnc play paling;Positif
really uncle really chaotic cs hide tweet problems dm anything dm;Negatif
really using xlhome smoothly;Netral
really xlhome;Positif
really xlhome ajg rto come every day hilarious;Netral
really xlhome new year x interrupted really;Netral
reason moved indihome xlhome already expensive test little shake signal;Netral
reason please suggest dm xlhome fiber help check thanks adi;Netral
recommended indihome xlhome;Netral
recurrence totally dead;Positif
red pound indicator always problem center still told try restart xlhome;Netral
regard assisted xlhome fiber team please wait information adi;Positif
regard let s check service information also directly xlhome fiber product detailed information thanks adi;Negatif
regarding ask please go product use xlhome fiber xlhome unlimited adi;Netral
regarding complaints xlhome fiber services conveyed via dm sis fitri;Positif
regarding information complaints xlhome fiber service conveyed via dm fitri;Positif
regarding matter anything help xlhome adi;Netral
regarding matter course maintain quality network things want ask xlhome fiber services contact us adi;Netral
regarding matter help continue xlhome team sis please wait next update adi;Netral
regarding matter please wait update currently working expanding xlhome fiber network area adi;Positif
regarding matter waiting dm arif immediately help report xlhome fiber team thanks adi;Positif
regarding netflix services included xlhome fiber sis service subscribe outside xlhome fiber monthly subscription adi;Netral
regarding please check website sis area covered xlhome optical fiber help installation procurement location brother covered fingers;Netral
regarding please wait good news yes currently working expanding xlhome fiber network area rose also check update directly know thanks adi;Netral
regarding xlhome fiber kio asked adi;Netral
regarding xlhome fiber service conveyed via message;Netral
regarding xlhome fiber service questionable adi;Positif
regarding xlhome fiber service quota limit limits use fup check data adi;Netral
