Tweet;klasifikasi
hi dys related xlhome fiber services conveyed via dm dian;Positif
hi dystopian anything asked xlhome fiber service dian;Positif
hi eci check simprug de poris area covered xlhome fiber tissue please inform first full address based name housing road block house number via dm help check process first adi;Positif
hi edowmaddusila apologize inconvenience regarding xlhome fiber services conveyed via dm thanks dian;Positif
hi edwards anything help xlhome adi;Positif
hi edy anything help xlhome adi;Positif
hi effendi anything help xlhome adi;Positif
hi effendi information xlhome fiber service conveyed via dm sis fitri;Positif
hi eka anything help xlhome fiber thanks adi;Positif
hi eka currently kebumen area still covered xlhome fiber eka submit additional network eka area website make recommendation;Positif
hi eka good morning besides mbps package xlhome fiber also mbps package let s check directly details information submit quite clear;Positif
hi eka informed advance yes full address via dm based name housing complex road block rt rw house number help check whether eka area covered xlhome network dian;Positif
hi ekasabi inform xlhome internet service including xlhome entertainment service subscribe xlhome get set top box android tv box connected;Positif
hi ekky related xlhome fiber service conveyed via message yes dian;Positif
hi eko anything help xlhome fiber thanks adi;Positif
hi eko related xlhome fiber services conveyed via dm dian;Positif
hi el sorry inconvenience regarding xlhome fiber services conveyed via dm thanks dian;Positif
hi elbow anything help xlhome adi;Positif
hi eldest anything help xlhome adi;Netral
hi elsafan anything help xlhome adi;Positif
hi else surf free month another day let s subscribe xlhome info visit website thanks amalia;Positif
hi else surf free month let s subscribe xlhome info visit website thanks amalia;Positif
hi else surf free month let s subscribe xlhome information visit website thanks amalia;Positif
hi elvira help xlhome adi;Positif
hi em sorry inconvenience regarding xlhome fiber services conveyed via dm yes dian;Positif
hi erga sorry inconvenience regarding xlhome fiber services conveyed via dm thanks dian;Positif
hi eriko anything asked xlhome fiber service thanks dian;Positif
hi ershad questions xlhome contact us xl free non-xl normal rates xlhomecs co idfb xl hometwitter adi;Positif
hi erwinsyah thank things want ask xlhome fiber services contact us thanks adi;Positif
hi erza related xlhome fiber services conveyed via dm dian;Positif
hi eva anything help xlhome fiber thanks adi;Positif
hi eva let s go straight dm anyone wants asked xlhome fiber service thanks adi;Positif
hi evan anything asked xlhome fiber service sis regarding xlhome fiber services conveyed via dm fitri;Positif
hi ezen else surf free moon let s subscribe xlhome info visit website thanks amalia;Positif
hi fadel questions complaints related xlhome services delivered via dm raffi;Positif
hi fadhila let s subscribe xlhome watch netflix relaxing directly tv dian;Positif
hi fadhilah anything help xlhome adi;Negatif
hi fadla anything help xlhome adi;Positif
hi fahmi related information complaints xlhome fiber service conveyed via dm dev;Positif
hi fahmy anything help xlhome adi;Positif
hi fahrurizani anything help xlhome fiber thanks adi;Positif
hi faisal anything help xlhome adi;Positif
hi faisal related xlhome fiber services conveyed via dm dian;Netral
hi faisal related xlhome fiber services conveyed via dm fitri;Positif
hi faizal anything help xlhome adi;Positif
hi faizal thank whether help xlhome adi;Positif
hi fajar help xlhome adi;Positif
hi fajar related xlhome fiber services conveyed via dm fitri;Positif
hi fajri let s check information related xlhome fiber services products thanks adi;Positif
hi fakhri anything help xlhome fiber thanks adi;Netral
hi faqih related complaints xlhome fiber services conveyed via dm fitri;Negatif
hi far regarding said helped xlhome fiber team please wait update later adi;Positif
hi far related xlhome fiber services conveyed via dm dian;Positif
hi farah anything help xlhome adi;Positif
hi farah good afternoon help xlhome fiber thanks adi;Positif
hi farhan anything help xlhome adi;Negatif
hi farhan related information complaints xlhome fiber service conveyed via message yes april;Netral
hi farij anything help xlhome adi;Positif
hi faris anything help xlhome adi;Positif
hi fariz let s subscribe xlhome watch netflix relaxing directly tv adi;Positif
hi fathanyr apologize inconvenience regarding xlhome fiber services conveyed via dm thanks dian;Netral
hi father anything help xlhome fiber thanks adi;Positif
hi father help xlhome fiber thanks adi;Netral
hi father mother anything help xlhome fiber thanks adi;Positif
hi fathin related xlhome fiber services conveyed via dm fitri;Positif
hi fathur anything help xlhome fiber adi;Positif
hi faturrahman let s subscribe xlhome watch netflix relaxing directly tv dian;Positif
hi fauzan anything help xlhome fiber thanks adi;Positif
hi fauzan related xlhome fiber services conveyed via dm thanks dian;Positif
hi faysn xlhome fiber provided device specifically check details directly information thanks adi;Positif
hi fazlurrahman anything help xlhome adi;Positif
hi fazrian anything help xlhome adi;Positif
hi febby anything asked xlhome fiber service dian;Positif
hi fella related xlhome fiber services conveyed via dm dian;Positif
hi feni check area still covered xlhome fiber network please replay email personal data area covered network xlhome team confirm registration adi;Positif
hi feni please register advance area covered area network xlhome team contact adi;Positif
hi feshnr related xlhome fiber services conveyed via dm dian;Positif
hi fierce anything help xlhome fiber adi;Positif
hi fifafou related xlhome fiber services conveyed via dm dian;Positif
hi fiki apologize inconvenience regarding xlhome fiber services conveyed via dm thanks dian;Positif
hi fikri could let s subscribe xlhome watch netflix relaxing directly tv adi;Positif
hi fikri good still things want ask xlhome fiber service contact us adi;Netral
hi firdaus anything help xlhome adi;Positif
hi firdaus apologize inconvenience regarding xlhome fiber services conveyed via dm thanks dian;Positif
hi firdaus currently xlhome fiber still stage developing network areas please wait update information whether area covered please check adi;Positif
hi firdaus let s check related service information area range covered xlhome fiber services thanks adi;Netral
hi firdaus still things want ask xlhome fiber services contact us adi;Positif
hi firdaus xlhome help adi;Netral
hi firmansyahfafan anything help xlhome adi;Positif
hi first related xlhome fiber services delivered dm fitri;Positif
hi fitri anything help xlhome adi;Netral
hi francis anything asked xlhome fiber service dian;Positif
hi franco apologize inconvenience regarding xlhome fiber services conveyed via dm yes dian;Positif
hi frans regarding expansion xlhome fiber tissue area let s check directly currently expanding fiber network area hopefully frans area covered network services thanks adi;Positif
hi franslasya else surf free moon let s subscribe xlhome info visit website thanks amalia;Positif
hi fredd check area time still covered xlhome fiber network information whether area covered please check adi;Positif
hi fuad anything help xlhome adi;Positif
hi galih anything asked xlhome fiber service dian;Positif
hi galih anything help xlhome fiber thanks adi;Positif
hi galih help check address covered xlhome fiber network information whether area covered please check yes dian;Netral
hi galih regarding expansion xlhome fiber network area please wait update let s check directly information details thanks adi;Positif
hi galuh good morning help xlhome fiber thanks adi;Positif
hi galuh related xlhome fiber services conveyed via dm dian;Positif
hi gambeng anything help xlhome adi;Positif
hi ganes xlhome fiber service fup adi;Negatif
hi garin sorry help check time garin area still covered xl home fiber network information whether garin area covered please check;Positif
hi garin still things want ask xlhome fiber services contact us adi;Netral
hi gayus related xlhome fiber services conveyed via dm dian;Positif
hi gege related xlhome fiber services conveyed via dm huh dian;Positif
hi gelz anything asked xlhome fiber service thanks dian;Positif
hi gendis related complaints xlhome fiber services conveyed via dm fitri;Negatif
hi giancarlo isp can t access netflix sis change xlhome oops adi;Positif
hi giri check area time still covered xlhome fiber network information whether area covered please check adi;Positif
hi gitasaf yuhuuu football fans watch favorite leagues videos xlhome dian;Positif
hi glwg good evening sis related new xlhome fiber payment done received email bill sender s e-mail inform official path payment xl home services;Positif
hi good afternoon anything help xlhome fiber adi;Positif
hi good afternoon anything help xlhome fiber thanks adi;Positif
hi good afternoon help xlhome fiber thanks adi;Netral
hi good anything help xlhome adi;Positif
hi good check latest xlhome fiber promo update please access adi;Positif
hi good morning help xlhome fiber adi;Positif
hi good morning help xlhome fiber thanks adi;Positif
hi good morning want get gift xlhome fiber easy monitor social media follow quiz hopefully lucky ones thanks adi;Negatif
hi good night help xlhome fiber thanks adi;Positif
hi good related xlhome fiber services conveyed via dm huh dian;Positif
hi good thanks annisa;Netral
hi goright related information complaints xlhome fiber service conveyed via message april;Positif
hi gunadi gunadi time still process expanding regarding xlhome fiber gunadi service conveyed via dm fitri;Positif
hi gung could let s subscribe xlhome watch netflix relaxing directly tv adi;Positif
hi gung related xlhome fiber services conveyed via dm dian;Positif
hi gusmaraajah still xl home promo end month else free internet let s subscribe xlhome info visit website thanks amalia;Positif
hi haerul currently xlhome still stage expanding network area time details cannot inform information whether area covered please check adi;Positif
hi haerul working expanding fiber area area please wait check updating area covered xlhome fiber network thanks adi;Negatif
hi haerunn area covered xlhome registration installation cannot done need worry currently xlhome expanding network expect location brother b;Positif
hi hafiz currently xlhome fiber already several cities sis please inform first full address based name housing road block house number via dm yes sis help first check location adi;Positif
hi halfin anything help xlhome fiber adi;Positif
hi halim anything asked xlhome fiber service thanks dian;Positif
hi haloha anything help xlhome adi;Positif
hi hammi anything help xlhome fiber thanks adi;Positif
hi hamzah anything help xlhome fiber adi;Positif
hi hamzah related xlhome fiber services conveyed via dm dian;Positif
hi hans help xl home products regarding xlhome fiber services conveyed via dm fitri;Positif
hi hanum check area time still covered xlhome fiber tissue information whether area covered please check adi;Positif
hi hanza anything help xlhome adi;Netral
hi har related xlhome fiber services conveyed via dm dian;Netral
hi haris time xlhome fiber still expansion network area still still covering poor area wait update check regularly thanks adi;Positif
hi harry else surf free month let s subscribe xlhome information visit website via dm thanks amalia;Netral
hi harry sorry inconvenience regarding xlhome fiber services conveyed via dm yes dian;Positif
hi hart anything help xlhome adi;Positif
hi haryanto help check address covered xlhome fiber network currently expanding network cannot convey time details still pen process;Positif
hi harza related xlhome fiber services conveyed via dm dian;Positif
hi hasdin anything help xlhome adi;Positif
hi hass anything help xlhome adi;Positif
hi hawe anything help xlhome adi;Negatif
hi hawe help xlhome adi;Negatif
hi haya else surf free month let s subscribe xlhome info visit website thanks amalia;Negatif
hi hayat help check life address covered xlhome fiber network information whether life area covered please check yes dian;Positif
hi heikev related xlhome fiber services conveyed via dm dian;Positif
hi hell sorry anything help xlhome fiber adi;Positif
hi help xlhome adi;Netral
hi herdian anything help xlhome fiber adi;Positif
hi heri good morning help xlhome fiber thanks adi;Positif
hi heru else surf free month let s subscribe xlhome information visit website dm thanks amalia;Positif
hi heru yeaay watching netflix using xlhome use complicated sis raffi;Positif
hi hikmad anything asked xlhome fiber service fitri;Positif
hi hikmad related xlhome fiber services conveyed via dm dian;Positif
hi hilmy anything help xlhome adi;Positif
hi hoela anything help xlhome adi;Positif
hi horis questions xlhome contact us xl free non-xl normal rates xlhomecs co idfb xl hometwitter vevi;Positif
hi husni check area time still covered xlhome fiber network information whether area covered please check adi;Positif
hi huswantoro related complaints xlhome fiber service conveyed via dm sis fitri;Positif
hi huzaeni currently xlhome fiber still effort expand network information whether area covered please check adi;Positif
hi hyolyn anything asked xlhome fiber service dian;Positif
hi ibnu anything asked xlhome fiber service dian;Positif
hi ibu accountsimiwa sorry inconvenience still things want ask xlhome fiber service contact us thanks adi;Positif
hi ibu aisah related xlhome fiber services conveyed via dm thanks ahmad;Positif
hi ibu april regarding network service course always guard questions xlhome fiber service please convey via dm forget follow account yes thanks adi;Positif
hi ibu cantika currently area still covered xlhome fiber information whether area covered please check wait update thanks adi;Netral
hi ibu ida related xlhome fiber services conveyed via dm thanks ersa;Netral
hi ibu iin related xlhome fiber services conveyed via dm thanks ahmad;Positif
hi ibu ika currently branch office available questions xlhome please contact us xl free non-xl normal rates xlhomecs co idfb xl hometwitter cont;Positif
hi ibu isma let s switch dm related complete information xlhome fiber service offer thanks adi;Negatif
hi ibu lintang related xlhome fiber services conveyed via dm thanks ahmad;Netral
hi ibu may xlhome fiber super fast internet access service using optical fiber cables also provides home entertainment products form set top boxes digital tv decoder android tv box course used learn online cont;Netral
hi ibu pristia related xlhome fiber services conveyed via dm thanks ahmad;Positif
hi ibu putri related xlhome fiber services conveyed via dm thanks ahmad;Positif
hi ibu putri related xlhome fiber services conveyed via dm thanks retno;Netral
hi ibu putri sorry sorry uncomfortable regarding xlhome fiber services conveyed via dm thanks ersa;Negatif
hi idjon related xlhome fiber services conveyed via dm thanks dian;Netral
hi ifka related xlhome fiber services conveyed via dm thanks dian;Positif
hi ihsan anything help xlhome adi;Netral
hi ihsan else surf free moon let s subscribe xlhome info visit website thanks amalia;Netral
hi iim anything help xlhome fiber thanks adi;Netral
hi ikhsan related xlhome fiber services conveyed via dm thanks dian;Netral
hi iksan anything help xlhome adi;Positif
hi iksan questions complaints related xlhome services delivered via dm raffi;Netral
hi ilham anything help xlhome adi;Positif
hi ilham anything help xlhome fiber thanks adi;Positif
hi ilham let s subscribe xlhome watch netflix relaxing directly tv adi;Netral
hi ilham related xlhome fiber services conveyed via dm thanks ersa;Positif
hi ilhamledyanputra anything asked xlhome fiber service thanks dian;Positif
hi imam anything help xlhome adi;Netral
hi imam thank support anything help xlhome adi;Positif
hi iman related xlhome fiber service conveyed via dm dian;Netral
hi iman thank subscribing xlhome fiber things want ask xlhome fiber service contact us thanks adi;Netral
hi imantaka let s subscribe xlhome watch netflix relaxing directly tv fitri;Positif
hi imdaad related xlhome fiber services conveyed via dm thanks dian;Positif
hi indah anything asked xlhome fiber service dian;Positif
hi indira anything help xlhome fiber adi;Positif
hi indra anything help xlhome adi;Positif
hi indra anything help xlhome fiber thanks adi;Netral
hi indra let s go straight dm detailed information xlhome fiber service thanks adi;Netral
hi inform address details first via dm mimin later mimin helps check scope thanks yud;Positif
hi information also go message thanks annisa;Netral
hi informed advance full address via dm based name housing complex roads blocks rt rw well house numbers help check whether area covered xlhome network dian;Netral
hi initials d help xlhome fiber thanks adi;Negatif
hi iponk anything help xlhome adi;Netral
hi ippi regarding details xlhome fiber service directly dm thanks adi;Positif
hi iqbal anything help xlhome fiber adi;Netral
hi ira regarding matter xlhome fiber trying expand fiber network area regarding exact time still can t inform expect future xlhome network f;Netral
hi ira related xlhome fiber services conveyed via dm vevi;Netral
hi irdi anything help xlhome fiber adi;Positif
hi irdi related xlhome fiber services conveyed via dm dian;Negatif
hi irfan anything help xlhome adi;Positif
hi irfan let s subscribe xlhome watch netflix relaxing directly tv adi;Positif
hi irfan sorry sis present xlhome fiber still expansion network yet reached location pantingin cover update adi;Netral
hi irra anything asked xlhome fiber service dian;Positif
hi irvan anything help xlhome adi;Positif
hi irvan anything help xlhome fiber thanks adi;Positif
hi irwan anything help xlhome adi;Netral
hi isnadi let s subscribe xlhome watch netflix relaxing directly tv dian;Netral
hi jace anything help xlhome adi;Netral
hi jack anything help xlhome adi;Positif
hi jafar anything asked xlhome fiber service fitri;Netral
hi jajang anything help xlhome adi;Netral
hi je suis good morning help xlhome fiber thanks adi;Netral
hi jek anything help xlhome fiber thanks adi;Netral
hi jengkelin anything help xlhome adi;Netral
hi jenny check area address appeared yet please register advance address column yet covered team call back address covered xlhome fiber network adi;Positif
hi jer anything asked xlhome fiber service dian;Netral
hi jeremy let s subscribe xlhome watch netflix relaxing directly tv dian;Netral
hi jeri related xlhome fiber services conveyed via dm thanks dian;Netral
hi jerry currently xlhome fiber already city bekas sis please inform first full address based name housing road block house number via dm help check process first adi;Positif
hi jes sorry inconvenience regarding xlhome fiber services conveyed via message thanks dian;Netral
hi jesslyn anything help xlhome adi;Netral
hi jimmy anything help xlhome fiber please dm adi;Positif
hi joe anything asked xlhome fiber service fitri;Netral
hi joe anything help xlhome adi;Netral
hi joelina xlhome fiber super fast internet access service using optical fiber cables also provides home entertainment products form set top boxes digital tv decoder android tv box thanks adi;Positif
hi john check area time still covered xlhome fiber network information whether area covered please check adi;Negatif
hi john related xlhome fiber services conveyed via dm fitri;Positif
hi jonathan good afternoon anything help xlhome fiber thanks adi;Positif
hi jr else surf free month let s subscribe xlhome info directly visit website via dm thanks amalia;Netral
hi jughead sorry something asked xlhome fiber service dian;Positif
hi juli anything help xlhome adi;Positif
hi julius anything help xlhome adi;Netral
hi juna anything help xlhome adi;Netral
hi jusri anything help xlhome fiber thanks adi;Positif
hi k anything help xlhome adi;Positif
hi ka anything help xlhome fiber adi;Positif
hi ka erfina kencana regency pakansari cibinong disorder tired actually complained trs never understood xlhome;Positif
hi kak adiityar related xlhome fiber services conveyed via message thanks yuri;Netral
hi kak alans related xlhome fiber service conveyed via message thanks ersa;Positif
hi kak alin related xlhome fiber service conveyed via dm thanks dian ag;Positif
hi kak andi related xlhome fiber services conveyed via message thanks ersa;Netral
hi kak andry related xlhome fiber services conveyed via message thanks ersa;Positif
hi kak anton related xlhome fiber services conveyed via dm thanks ersa;Netral
hi kak asep information xl home one faster handling maya suggests bias contacting digital care xlhome via email xlhomecs co id fb xlhomeid twitter phone xl cont;Netral
hi kak azfka related xlhome fiber services conveyed via dm thanks ersa;Netral
hi kak bullung questions related xlhome program let s dm thanks ersa;Negatif
hi kak chaeroel related xlhome fiber services conveyed via dm thanks dian;Netral
hi kak david xlhome fiber super fast internet access service using optical fiber cables also provides home entertainment products form set top boxes digital tv decoder android tv box thanks adi;Positif
hi kak dedi related xlhome fiber services conveyed via dm thanks dian;Netral
hi kak derrynasution apologize inconvenience regarding xlhome fiber services conveyed via dm thanks dian;Netral
hi kak derrynasution related xlhome fiber services conveyed via dm thanks dian;Netral
hi kak diarawythkim related xlhome fiber services conveyed via dm thanks dian;Positif
hi kak fauzan related xlhome fiber services conveyed via dm thanks ersa;Positif
hi kak fauzandezaan related xlhome fiber service conveyed via dm thanks dian;Positif
hi kak gilangtzy related xlhome fiber services conveyed via dm thanks dian;Positif
hi kak hamzah apologize inconvenience regarding xlhome fiber services conveyed via dm thanks dian;Netral
hi kak hendri related xlhome fiber services conveyed via message thanks ersa;Netral
hi kak hendro currently area karang satria karang bumi orchid still covered xlhome fiber information whether area covered please check wait update sis thanks adi;Netral
hi kak henri related xlhome fiber services conveyed via dm thanks dian;Netral
hi kak huda check puri bojong lestari residential area still covered xlhome fiber information whether area covered please check wait update sis thanks adi;Positif
hi kak jeffero related xlhome fiber services conveyed via message thanks ersa;Netral
hi kak kielelelele related xlhome fiber service conveyed via dm thanks dian;Positif
hi kak lao say currently xlhome fiber expanding network area let s help us filling data link;Netral
hi kak lilik related xlhome fiber services conveyed via dm immediately help check thanks ersa;Positif
hi kak lukman related xlhome fiber service conveyed via dm thanks dian;Positif
hi kak made related xlhome fiber services conveyed via dm thanks ersa;Netral
hi kak mahfud related xlhome fiber service conveyed via message thanks ersa;Positif
hi kak niaga xlhome customer service contacted calling xl thanks;Positif
hi kak pandu sorry inconvenience yes related xlhome fiber services conveyed via message thanks ersa;Positif
hi kak prawira currently xlhome fiber still expansion network area let s submit additional network brother s area website make recommendation;Negatif
hi kak purwaningrum fun check yuk sis related service information xlhome fiber products thanks adi;Positif
hi kak putra regarding matter xlhome fiber make material consideration expansion area sis hopefully area kak putra covered soon thanks adi;Positif
hi kak rahmadhi related xlhome fiber services conveyed via message thanks ersa;Positif
hi kak rangga related xlhome fiber services conveyed via message thanks ersa;Positif
hi kak ricky related xlhome fiber service conveyed via dm thanks dian;Positif
hi kak rifai interested xlhome fiber service immediately dm sis check know thanks adi;Positif
hi kak rifo related xlhome fiber services conveyed via dm thanks dian;Positif
hi kak rky xlhome fiber super fast internet access service using optical fiber cables also provides home entertainment products form set top boxes digital tv decoder android tv box detailed information conveyed via dm thanks mira;Netral
hi kak ry related details xlhome fiber service conveyed via dm thanks ersa;Positif
hi kak susilo currently area still covered xlhome fiber information whether area covered please check wait update thanks adi;Positif
hi kak syahril related xlhome fiber services conveyed via message thanks ersa;Netral
hi kak syahriza currently area still covered xlhome fiber information whether area covered please check wait update thanks adi;Negatif
hi kak vade brother connected xlhome fiber service help xlhome fiber thanks adi;Netral
hi kak valar related xlhome fiber services conveyed via dm thanks dian;Positif
hi kak yanty related xlhome fiber services conveyed via message thanks ersa;Positif
hi kak yuliwaching thank information enjoy xlhome fiber service still things want ask xlhome fiber service contact us thanks yuri;Negatif
hi kaka anything help xlhome fiber products adi;Netral
hi kaka anything help xlhome fiber thanks adi;Netral
hi kamal related xlhome fiber services conveyed via dm thanks dian;Netral
hi kamalms apologize inconvenience regarding xlhome fiber services conveyed via dm thanks dian;Positif
hi kamidi anything help xlhome fiber thanks adi;Positif
hi kangmas currently xlhome fiber trying expand network area follow enthusiasm kangmas get xl home services considering planner;Netral
hi katon anything help xlhome adi;Netral
hi katsuwonus anything help xlhome fiber thanks adi;Netral
hi kcon anything help xlhome adi;Netral
hi kef related xlhome fiber services conveyed via dm three package options family mbps idr rb-super users mbps idr rb-ultimate gbps idr rb fitri;Netral
hi kei related xlhome fiber services conveyed via dm dian;Netral
